{
  "id": "shot_opening_calm_001",
  "type": "shot_pattern",
  "category": "opening",
  "name": "Calm opening shot",
  "description": "Slow opening establishing the subject and tone.",
  "applies_to": [
    "text_to_video",
    "image_to_video",
    "storyboard",
    "keyframe"
  ],
  "not_recommended_for": [],
  "prompt_fragments": {
    "generic": "calm opening shot, slow establishing pace, sets tone and subject"
  },
  "parameters": {
    "shot_role": "opening",
    "duration_hint_seconds": 3
  },
  "compatible_with": [],
  "avoid_with": [],
  "tags": [
    "shot",
    "opening",
    "establishing"
  ],
  "quality_score": 0.72,
  "status": "active",
  "version": "0.1",
  "notes": "synthesized from recurring patterns observed in raw_corpus/",
  "source": {
    "file": "raw_corpus/",
    "method": "human-synthesis from recurring families"
  }
}
